{
  "$schema": "https://json-schema.org/draft/2020-12/schema",
  "title": "Garazyk Doc Registry",
  "type": "array",
  "items": {
    "type": "object",
    "required": [
      "path",
      "classification",
      "canonical_target",
      "owner",
      "status"
    ],
    "properties": {
      "path": {
        "type": "string"
      },
      "classification": {
        "type": "string",
        "enum": [
          "canonical",
          "archive",
          "entrypoint",
          "internal-reference"
        ]
      },
      "canonical_target": {
        "type": "string"
      },
      "owner": {
        "type": "string"
      },
      "status": {
        "type": "string"
      }
    },
    "additionalProperties": false
  }
}
