[
  {
    "path": "ADMINUI_DEPLOYMENT_GUIDE.md",
    "classification": "entrypoint",
    "canonical_target": "docs/11-reference/admin-ui-documentation.md",
    "owner": "docs",
    "status": "active"
  },
  {
    "path": "ADMINUI_PROJECT_COMPLETE.md",
    "classification": "entrypoint",
    "canonical_target": "docs/11-reference/admin-ui-documentation.md",
    "owner": "docs",
    "status": "active"
  },
  {
    "path": "ADMINUI_QUICKSTART.md",
    "classification": "entrypoint",
    "canonical_target": "docs/11-reference/admin-ui-documentation.md",
    "owner": "docs",
    "status": "active"
  },
  {
    "path": "ADMINUI_START_HERE.md",
    "classification": "entrypoint",
    "canonical_target": "docs/11-reference/admin-ui-documentation.md",
    "owner": "docs",
    "status": "active"
  },
  {
    "path": "AGENTS.md",
    "classification": "entrypoint",
    "canonical_target": "docs/11-reference/documentation-map.md",
    "owner": "docs",
    "status": "active"
  },
  {
    "path": "AGENTS_QUICKREF.md",
    "classification": "entrypoint",
    "canonical_target": "docs/11-reference/documentation-map.md",
    "owner": "docs",
    "status": "active"
  },
  {
    "path": "BUILD.md",
    "classification": "entrypoint",
    "canonical_target": "docs/01-getting-started/setup.md",
    "owner": "docs",
    "status": "active"
  },
  {
    "path": "CLAUDE.md",
    "classification": "internal-reference",
    "canonical_target": "docs/index.md",
    "owner": "docs",
    "status": "reference"
  },
  {
    "path": "CONTRIBUTING.md",
    "classification": "entrypoint",
    "canonical_target": "docs/index.md",
    "owner": "docs",
    "status": "active"
  },
  {
    "path": "DOCUMENTATION.md",
    "classification": "entrypoint",
    "canonical_target": "docs/11-reference/documentation-map.md",
    "owner": "docs",
    "status": "active"
  },
  {
    "path": "Garazyk/Frameworks/README.md",
    "classification": "internal-reference",
    "canonical_target": "docs/11-reference/source-adjacent-documentation.md",
    "owner": "core",
    "status": "reference"
  },
  {
    "path": "Garazyk/Sources/Admin/ADMINUI_ARCHITECTURE.md",
    "classification": "internal-reference",
    "canonical_target": "docs/11-reference/admin-ui-documentation.md",
    "owner": "admin",
    "status": "reference"
  },
  {
    "path": "Garazyk/Sources/Admin/ADMINUI_DELIVERY_SUMMARY.md",
    "classification": "internal-reference",
    "canonical_target": "docs/11-reference/admin-ui-documentation.md",
    "owner": "admin",
    "status": "reference"
  },
  {
    "path": "Garazyk/Sources/Admin/ADMINUI_IMPLEMENTATION_STATUS.md",
    "classification": "internal-reference",
    "canonical_target": "docs/11-reference/admin-ui-documentation.md",
    "owner": "admin",
    "status": "reference"
  },
  {
    "path": "Garazyk/Sources/Admin/ADMINUI_INTEGRATION.md",
    "classification": "internal-reference",
    "canonical_target": "docs/11-reference/admin-ui-documentation.md",
    "owner": "admin",
    "status": "reference"
  },
  {
    "path": "Garazyk/Sources/Admin/ADMINUI_INTEGRATION_COMPLETE.md",
    "classification": "internal-reference",
    "canonical_target": "docs/11-reference/admin-ui-documentation.md",
    "owner": "admin",
    "status": "reference"
  },
  {
    "path": "Garazyk/Sources/Admin/Diagnostics/README.md",
    "classification": "internal-reference",
    "canonical_target": "docs/11-reference/admin-ui-documentation.md",
    "owner": "admin",
    "status": "reference"
  },
  {
    "path": "Garazyk/Sources/Database/ARCHITECTURE.md",
    "classification": "internal-reference",
    "canonical_target": "docs/11-reference/source-adjacent-documentation.md",
    "owner": "core",
    "status": "reference"
  },
  {
    "path": "Garazyk/Sources/Database/README.md",
    "classification": "internal-reference",
    "canonical_target": "docs/11-reference/source-adjacent-documentation.md",
    "owner": "core",
    "status": "reference"
  },
  {
    "path": "Garazyk/Tests/fixtures/atproto-interop-tests/README.md",
    "classification": "internal-reference",
    "canonical_target": "docs/11-reference/source-adjacent-documentation.md",
    "owner": "core",
    "status": "reference"
  },
  {
    "path": "Garazyk/Tests/plc_e2e/README.md",
    "classification": "internal-reference",
    "canonical_target": "docs/11-reference/source-adjacent-documentation.md",
    "owner": "core",
    "status": "reference"
  },
  {
    "path": "Garazyk/docs-site/README.md",
    "classification": "internal-reference",
    "canonical_target": "docs/11-reference/source-adjacent-documentation.md",
    "owner": "core",
    "status": "reference"
  },
  {
    "path": "Garazyk/docs-site/src/content/docs/advanced-parsing/db-pool-concurrency.md",
    "classification": "internal-reference",
    "canonical_target": "docs/11-reference/source-adjacent-documentation.md",
    "owner": "core",
    "status": "reference"
  },
  {
    "path": "Garazyk/docs-site/src/content/docs/advanced-parsing/fast-parsing.md",
    "classification": "internal-reference",
    "canonical_target": "docs/11-reference/source-adjacent-documentation.md",
    "owner": "core",
    "status": "reference"
  },
  {
    "path": "Garazyk/docs-site/src/content/docs/advanced-parsing/sans-io-architecture.md",
    "classification": "internal-reference",
    "canonical_target": "docs/11-reference/source-adjacent-documentation.md",
    "owner": "core",
    "status": "reference"
  },
  {
    "path": "Garazyk/docs-site/src/content/docs/atproto/cryptography.md",
    "classification": "internal-reference",
    "canonical_target": "docs/11-reference/source-adjacent-documentation.md",
    "owner": "core",
    "status": "reference"
  },
  {
    "path": "Garazyk/docs-site/src/content/docs/atproto/data-modeling.md",
    "classification": "internal-reference",
    "canonical_target": "docs/11-reference/source-adjacent-documentation.md",
    "owner": "core",
    "status": "reference"
  },
  {
    "path": "Garazyk/docs-site/src/content/docs/atproto/merkle-search-trees.md",
    "classification": "internal-reference",
    "canonical_target": "docs/11-reference/source-adjacent-documentation.md",
    "owner": "core",
    "status": "reference"
  },
  {
    "path": "Garazyk/docs-site/src/content/docs/auth/hardware-security.md",
    "classification": "internal-reference",
    "canonical_target": "docs/11-reference/source-adjacent-documentation.md",
    "owner": "core",
    "status": "reference"
  },
  {
    "path": "Garazyk/docs-site/src/content/docs/auth/oauth-dpop.md",
    "classification": "internal-reference",
    "canonical_target": "docs/11-reference/source-adjacent-documentation.md",
    "owner": "core",
    "status": "reference"
  },
  {
    "path": "Garazyk/docs-site/src/content/docs/core-server/gcd-threading.md",
    "classification": "internal-reference",
    "canonical_target": "docs/11-reference/source-adjacent-documentation.md",
    "owner": "core",
    "status": "reference"
  },
  {
    "path": "Garazyk/docs-site/src/content/docs/core-server/http-server.md",
    "classification": "internal-reference",
    "canonical_target": "docs/11-reference/source-adjacent-documentation.md",
    "owner": "core",
    "status": "reference"
  },
  {
    "path": "Garazyk/docs-site/src/content/docs/core-server/sqlite-persistence.md",
    "classification": "internal-reference",
    "canonical_target": "docs/11-reference/source-adjacent-documentation.md",
    "owner": "core",
    "status": "reference"
  },
  {
    "path": "Garazyk/docs-site/src/content/docs/federation/firehose.md",
    "classification": "internal-reference",
    "canonical_target": "docs/11-reference/source-adjacent-documentation.md",
    "owner": "core",
    "status": "reference"
  },
  {
    "path": "Garazyk/docs-site/src/content/docs/federation/websockets.md",
    "classification": "internal-reference",
    "canonical_target": "docs/11-reference/source-adjacent-documentation.md",
    "owner": "core",
    "status": "reference"
  },
  {
    "path": "Garazyk/docs-site/src/content/docs/fundamentals/at-protocol.md",
    "classification": "internal-reference",
    "canonical_target": "docs/11-reference/source-adjacent-documentation.md",
    "owner": "core",
    "status": "reference"
  },
  {
    "path": "Garazyk/docs-site/src/content/docs/fundamentals/objective-c-env.md",
    "classification": "internal-reference",
    "canonical_target": "docs/11-reference/source-adjacent-documentation.md",
    "owner": "core",
    "status": "reference"
  },
  {
    "path": "Garazyk/docs/guides/objective_c_research_guide.md",
    "classification": "internal-reference",
    "canonical_target": "docs/11-reference/source-adjacent-documentation.md",
    "owner": "core",
    "status": "reference"
  },
  {
    "path": "Garazyk/docs/guides/objective_c_tips.md",
    "classification": "internal-reference",
    "canonical_target": "docs/11-reference/source-adjacent-documentation.md",
    "owner": "core",
    "status": "reference"
  },
  {
    "path": "README.md",
    "classification": "entrypoint",
    "canonical_target": "docs/index.md",
    "owner": "docs",
    "status": "active"
  },
  {
    "path": "docs/01-getting-started/architecture-overview.md",
    "classification": "canonical",
    "canonical_target": "docs/01-getting-started/architecture-overview.md",
    "owner": "docs",
    "status": "active"
  },
  {
    "path": "docs/01-getting-started/codebase-map.md",
    "classification": "canonical",
    "canonical_target": "docs/01-getting-started/codebase-map.md",
    "owner": "docs",
    "status": "active"
  },
  {
    "path": "docs/01-getting-started/local-debug-workflow.md",
    "classification": "canonical",
    "canonical_target": "docs/01-getting-started/local-debug-workflow.md",
    "owner": "docs",
    "status": "active"
  },
  {
    "path": "docs/01-getting-started/overview.md",
    "classification": "canonical",
    "canonical_target": "docs/01-getting-started/overview.md",
    "owner": "docs",